{
  "area": "tokyo",
  "date": "2025-10-24",
  "timezone": "Asia/Tokyo",
  "timescale": "hourly",
  "series": [
    {
      "ts": "2025-10-24T00:00:00+09:00",
      "demand_mw": 26654,
      "forecast_mw": 27010
    },
    {
      "ts": "2025-10-24T01:00:00+09:00",
      "demand_mw": 25892,
      "forecast_mw": 26305
    },
    {
      "ts": "2025-10-24T02:00:00+09:00",
      "demand_mw": 25128,
      "forecast_mw": 25453
    },
    {
      "ts": "2025-10-24T03:00:00+09:00",
      "demand_mw": 24785,
      "forecast_mw": 25012
    },
    {
      "ts": "2025-10-24T04:00:00+09:00",
      "demand_mw": 25013,
      "forecast_mw": 25238
    },
    {
      "ts": "2025-10-24T05:00:00+09:00",
      "demand_mw": 25897,
      "forecast_mw": 26124
    },
    {
      "ts": "2025-10-24T06:00:00+09:00",
      "demand_mw": 27562,
      "forecast_mw": 27809
    },
    {
      "ts": "2025-10-24T07:00:00+09:00",
      "demand_mw": 30125,
      "forecast_mw": 30451
    },
    {
      "ts": "2025-10-24T08:00:00+09:00",
      "demand_mw": 32984,
      "forecast_mw": 33342
    },
    {
      "ts": "2025-10-24T09:00:00+09:00",
      "demand_mw": 35126,
      "forecast_mw": 35518
    },
    {
      "ts": "2025-10-24T10:00:00+09:00",
      "demand_mw": 36893,
      "forecast_mw": 37285
    },
    {
      "ts": "2025-10-24T11:00:00+09:00",
      "demand_mw": 38012,
      "forecast_mw": 38426
    },
    {
      "ts": "2025-10-24T12:00:00+09:00",
      "demand_mw": 38567,
      "forecast_mw": 38994
    },
    {
      "ts": "2025-10-24T13:00:00+09:00",
      "demand_mw": 39124,
      "forecast_mw": 39563
    },
    {
      "ts": "2025-10-24T14:00:00+09:00",
      "demand_mw": 39685,
      "forecast_mw": 40132
    },
    {
      "ts": "2025-10-24T15:00:00+09:00",
      "demand_mw": 39451,
      "forecast_mw": 39897
    },
    {
      "ts": "2025-10-24T16:00:00+09:00",
      "demand_mw": 38896,
      "forecast_mw": 39338
    },
    {
      "ts": "2025-10-24T17:00:00+09:00",
      "demand_mw": 38342,
      "forecast_mw": 38779
    },
    {
      "ts": "2025-10-24T18:00:00+09:00",
      "demand_mw": 37568,
      "forecast_mw": 37994
    },
    {
      "ts": "2025-10-24T19:00:00+09:00",
      "demand_mw": 36235,
      "forecast_mw": 36651
    },
    {
      "ts": "2025-10-24T20:00:00+09:00",
      "demand_mw": 34452,
      "forecast_mw": 34863
    },
    {
      "ts": "2025-10-24T21:00:00+09:00",
      "demand_mw": 32347,
      "forecast_mw": 32748
    },
    {
      "ts": "2025-10-24T22:00:00+09:00",
      "demand_mw": 30123,
      "forecast_mw": 30515
    },
    {
      "ts": "2025-10-24T23:00:00+09:00",
      "demand_mw": 28346,
      "forecast_mw": 28729
    }
  ],
  "source": {
    "name": "TEPCO",
    "url": "https://www.tepco.co.jp/forecast/html/download-j.html"
  }
}