{
  "area": "kansai",
  "date": "2025-10-24",
  "timezone": "Asia/Tokyo",
  "timescale": "hourly",
  "series": [
    {
      "ts": "2025-10-24T00:00:00+09:00",
      "demand_mw": 12345,
      "forecast_mw": 12562
    },
    {
      "ts": "2025-10-24T01:00:00+09:00",
      "demand_mw": 11893,
      "forecast_mw": 12108
    },
    {
      "ts": "2025-10-24T02:00:00+09:00",
      "demand_mw": 11456,
      "forecast_mw": 11654
    },
    {
      "ts": "2025-10-24T03:00:00+09:00",
      "demand_mw": 11238,
      "forecast_mw": 11429
    },
    {
      "ts": "2025-10-24T04:00:00+09:00",
      "demand_mw": 11567,
      "forecast_mw": 11753
    },
    {
      "ts": "2025-10-24T05:00:00+09:00",
      "demand_mw": 11984,
      "forecast_mw": 12186
    },
    {
      "ts": "2025-10-24T06:00:00+09:00",
      "demand_mw": 12895,
      "forecast_mw": 13102
    },
    {
      "ts": "2025-10-24T07:00:00+09:00",
      "demand_mw": 14236,
      "forecast_mw": 14468
    },
    {
      "ts": "2025-10-24T08:00:00+09:00",
      "demand_mw": 15678,
      "forecast_mw": 15935
    },
    {
      "ts": "2025-10-24T09:00:00+09:00",
      "demand_mw": 16892,
      "forecast_mw": 17167
    },
    {
      "ts": "2025-10-24T10:00:00+09:00",
      "demand_mw": 17783,
      "forecast_mw": 18069
    },
    {
      "ts": "2025-10-24T11:00:00+09:00",
      "demand_mw": 18349,
      "forecast_mw": 18642
    },
    {
      "ts": "2025-10-24T12:00:00+09:00",
      "demand_mw": 18674,
      "forecast_mw": 18975
    },
    {
      "ts": "2025-10-24T13:00:00+09:00",
      "demand_mw": 18896,
      "forecast_mw": 19203
    },
    {
      "ts": "2025-10-24T14:00:00+09:00",
      "demand_mw": 19012,
      "forecast_mw": 19328
    },
    {
      "ts": "2025-10-24T15:00:00+09:00",
      "demand_mw": 18789,
      "forecast_mw": 19096
    },
    {
      "ts": "2025-10-24T16:00:00+09:00",
      "demand_mw": 18453,
      "forecast_mw": 18754
    },
    {
      "ts": "2025-10-24T17:00:00+09:00",
      "demand_mw": 18127,
      "forecast_mw": 18421
    },
    {
      "ts": "2025-10-24T18:00:00+09:00",
      "demand_mw": 17564,
      "forecast_mw": 17853
    },
    {
      "ts": "2025-10-24T19:00:00+09:00",
      "demand_mw": 16891,
      "forecast_mw": 17172
    },
    {
      "ts": "2025-10-24T20:00:00+09:00",
      "demand_mw": 15987,
      "forecast_mw": 16259
    },
    {
      "ts": "2025-10-24T21:00:00+09:00",
      "demand_mw": 14893,
      "forecast_mw": 15156
    },
    {
      "ts": "2025-10-24T22:00:00+09:00",
      "demand_mw": 13789,
      "forecast_mw": 14042
    },
    {
      "ts": "2025-10-24T23:00:00+09:00",
      "demand_mw": 12895,
      "forecast_mw": 13141
    }
  ],
  "source": {
    "name": "Kansai",
    "url": "https://www.kansai-td.co.jp/denkiyoho/"
  }
}